{
  "schema_version": 1,
  "reference_set_id": "qin_xuandu-core-v1",
  "character_id": "qin_xuandu",
  "version": 1,
  "label": "標準四面核心造型",
  "status": "approved",
  "is_primary": true,
  "references": [
    {
      "role": "turnaround",
      "path": "characters/qin_xuandu/images/qin_xuandu_turnaround_v1.png",
      "sha256": "da0031eb014fda0cdb25152e70e89843ba1d0512dbb5addcdd79661ff3a275b8",
      "media_type": "image/png",
      "source": "imagegen 標準四面總覽，2026-08-11 核准"
    },
    {
      "role": "full_body_front",
      "path": "characters/qin_xuandu/images/qin_xuandu_v1_front.png",
      "sha256": "d045337afd0695f2d16e346a87d14b9d11e1b4bb63d759746629ddf6e483571b",
      "media_type": "image/png",
      "source": "由核准四面總覽無損裁切：正面"
    },
    {
      "role": "full_body_three_quarter",
      "path": "characters/qin_xuandu/images/qin_xuandu_v1_three_quarter.png",
      "sha256": "52376e76e361655830b069d770e47a30c091682709919a9fa3e45a34b7ebf04e",
      "media_type": "image/png",
      "source": "由核准四面總覽無損裁切：四分之三"
    },
    {
      "role": "full_body_profile",
      "path": "characters/qin_xuandu/images/qin_xuandu_v1_profile.png",
      "sha256": "6c74abf900bdb408864ec5f253868b6141adef8725ca031d1010ce558e74ef60",
      "media_type": "image/png",
      "source": "由核准四面總覽無損裁切：完整側面"
    },
    {
      "role": "full_body_back",
      "path": "characters/qin_xuandu/images/qin_xuandu_v1_back.png",
      "sha256": "ee5b3c316e77467cf192d2d3a4abaa6b2728706e50c9cccbbece481e4f3080d4",
      "media_type": "image/png",
      "source": "由核准四面總覽無損裁切：背面"
    }
  ],
  "engine_bindings": {
    "codex": {
      "reference_roles": [
        "full_body_front",
        "full_body_three_quarter",
        "full_body_profile",
        "full_body_back"
      ],
      "notes": "場景生成前必須引用同一版本的四個獨立視角；turnaround 供人工整體核對。"
    },
    "gemini": {
      "reference_roles": [
        "full_body_front",
        "full_body_three_quarter",
        "full_body_profile",
        "full_body_back"
      ],
      "notes": "優先傳入四個獨立視角；受參考圖數限制時保留正面、四分之三與背面。"
    }
  }
}

