{
  "schema_version": 1,
  "reference_set_id": "qin_yuanshuo-core-v1",
  "character_id": "qin_yuanshuo",
  "version": 1,
  "label": "標準四面核心造型",
  "status": "approved",
  "is_primary": true,
  "references": [
    {
      "role": "turnaround",
      "path": "characters/qin_yuanshuo/images/qin_yuanshuo_turnaround_v1.png",
      "sha256": "8543bedad976301c2acfe1c731e68f4ce3c24c738384b46ac19ed14bbed8b39a",
      "media_type": "image/png",
      "source": "imagegen 標準四面總覽，2026-08-11 核准"
    },
    {
      "role": "full_body_front",
      "path": "characters/qin_yuanshuo/images/qin_yuanshuo_v1_front.png",
      "sha256": "0f18ec82f728c58f1aba6777ad97c4d79cbfff226c60f0136db2e32157e8c6cf",
      "media_type": "image/png",
      "source": "由核准四面總覽無損裁切：正面"
    },
    {
      "role": "full_body_three_quarter",
      "path": "characters/qin_yuanshuo/images/qin_yuanshuo_v1_three_quarter.png",
      "sha256": "0afe7030a1536d4df391d5dee6458c6077dc1373bce4181f2263e3279f9302c9",
      "media_type": "image/png",
      "source": "由核准四面總覽無損裁切：四分之三"
    },
    {
      "role": "full_body_profile",
      "path": "characters/qin_yuanshuo/images/qin_yuanshuo_v1_profile.png",
      "sha256": "f6d31967b8a7fb8c22bfb02e896afd7523912bf3c8bfe4fbafdac5bf729955d4",
      "media_type": "image/png",
      "source": "由核准四面總覽無損裁切：完整側面"
    },
    {
      "role": "full_body_back",
      "path": "characters/qin_yuanshuo/images/qin_yuanshuo_v1_back.png",
      "sha256": "9c3e3be0aadb02a4063270c440b33226c9a06c204451a12182469b2af8086ef3",
      "media_type": "image/png",
      "source": "由核准四面總覽無損裁切：背面"
    }
  ],
  "engine_bindings": {
    "codex": {
      "reference_roles": [
        "full_body_front",
        "full_body_three_quarter",
        "full_body_profile",
        "full_body_back"
      ],
      "notes": "場景生成前必須引用同一版本的四個獨立視角；turnaround 供人工整體核對。"
    },
    "gemini": {
      "reference_roles": [
        "full_body_front",
        "full_body_three_quarter",
        "full_body_profile",
        "full_body_back"
      ],
      "notes": "優先傳入四個獨立視角；受參考圖數限制時保留正面、四分之三與背面。"
    }
  }
}

