{
  "schema_version": 1,
  "reference_set_id": "zhu_heng-core-v1",
  "character_id": "zhu_heng",
  "version": 1,
  "label": "標準四面核心造型",
  "status": "approved",
  "is_primary": true,
  "references": [
    {
      "role": "turnaround",
      "path": "characters/zhu_heng/images/zhu_heng_turnaround_v1.png",
      "sha256": "9052b1e304305bc828747650a268e31f18ddba9f5e28fa22eac79f3d7c339c87",
      "media_type": "image/png",
      "source": "imagegen 標準四面總覽，2026-08-11 核准"
    },
    {
      "role": "full_body_front",
      "path": "characters/zhu_heng/images/zhu_heng_v1_front.png",
      "sha256": "817884ea53777e8744051f11a693e5525daa918e45e41aec08cea05626a3c472",
      "media_type": "image/png",
      "source": "由核准四面總覽無損裁切：正面"
    },
    {
      "role": "full_body_three_quarter",
      "path": "characters/zhu_heng/images/zhu_heng_v1_three_quarter.png",
      "sha256": "dc7cd5546f5c4ec342462de516e65af2d6280aa0e4c6253bc57965d5373730ff",
      "media_type": "image/png",
      "source": "由核准四面總覽無損裁切：四分之三"
    },
    {
      "role": "full_body_profile",
      "path": "characters/zhu_heng/images/zhu_heng_v1_profile.png",
      "sha256": "b9878a3b5a3587033f1ef1b9c044ad4075d6f7dcee0f1648a2c01216f24870b2",
      "media_type": "image/png",
      "source": "由核准四面總覽無損裁切：完整側面"
    },
    {
      "role": "full_body_back",
      "path": "characters/zhu_heng/images/zhu_heng_v1_back.png",
      "sha256": "c4dfb0e3375d892b4df5d3389a5b3cf170caeeea5e1195353798349819421590",
      "media_type": "image/png",
      "source": "由核准四面總覽無損裁切：背面"
    }
  ],
  "engine_bindings": {
    "codex": {
      "reference_roles": [
        "full_body_front",
        "full_body_three_quarter",
        "full_body_profile",
        "full_body_back"
      ],
      "notes": "場景生成前必須引用同一版本的四個獨立視角；turnaround 供人工整體核對。"
    },
    "gemini": {
      "reference_roles": [
        "full_body_front",
        "full_body_three_quarter",
        "full_body_profile",
        "full_body_back"
      ],
      "notes": "優先傳入四個獨立視角；受參考圖數限制時保留正面、四分之三與背面。"
    }
  }
}

