{
  "schema_version": 1,
  "reference_set_id": "lu_tingyun-core-v1",
  "character_id": "lu_tingyun",
  "version": 1,
  "label": "標準四面核心造型",
  "status": "approved",
  "is_primary": true,
  "references": [
    {
      "role": "turnaround",
      "path": "characters/lu_tingyun/images/lu_tingyun_turnaround_v1.png",
      "sha256": "a8290c7ee71c362314469c5788b70d284bc117053e9da8fbeeca8b68fed07e47",
      "media_type": "image/png",
      "source": "imagegen 標準四面總覽，2026-08-11 核准"
    },
    {
      "role": "full_body_front",
      "path": "characters/lu_tingyun/images/lu_tingyun_v1_front.png",
      "sha256": "9f14d10a8a2389c4d215c5fb958e28c3b4c8e4e122a467860cf0233e27635e04",
      "media_type": "image/png",
      "source": "由核准四面總覽無損裁切：正面"
    },
    {
      "role": "full_body_three_quarter",
      "path": "characters/lu_tingyun/images/lu_tingyun_v1_three_quarter.png",
      "sha256": "9f7b908757e51eccbff76d075a0c2330bce8529e1534a5002900b298cd8c6996",
      "media_type": "image/png",
      "source": "由核准四面總覽無損裁切：四分之三"
    },
    {
      "role": "full_body_profile",
      "path": "characters/lu_tingyun/images/lu_tingyun_v1_profile.png",
      "sha256": "e10f7775d45c23d67074891f3a2158a3700677d879ea1ae558ecc2775983c5f9",
      "media_type": "image/png",
      "source": "由核准四面總覽無損裁切：完整側面"
    },
    {
      "role": "full_body_back",
      "path": "characters/lu_tingyun/images/lu_tingyun_v1_back.png",
      "sha256": "241b8d7b9ca7be05bde1aa1092930601d0590ef107781907799829e90f2ae692",
      "media_type": "image/png",
      "source": "由核准四面總覽無損裁切：背面"
    }
  ],
  "engine_bindings": {
    "codex": {
      "reference_roles": [
        "full_body_front",
        "full_body_three_quarter",
        "full_body_profile",
        "full_body_back"
      ],
      "notes": "場景生成前必須引用同一版本的四個獨立視角；turnaround 供人工整體核對。"
    },
    "gemini": {
      "reference_roles": [
        "full_body_front",
        "full_body_three_quarter",
        "full_body_profile",
        "full_body_back"
      ],
      "notes": "優先傳入四個獨立視角；受參考圖數限制時保留正面、四分之三與背面。"
    }
  }
}

