{
  "schema_version": 1,
  "reference_set_id": "chiying-core-v3",
  "character_id": "chiying",
  "version": 3,
  "label": "臉部身份鎖定標準四面核心造型",
  "status": "approved",
  "is_primary": true,
  "references": [
    {
      "role": "face_front",
      "path": "characters/chiying/images/chiying_v3_face_anchor.png",
      "sha256": "3e9b45a7669b279052752ba9ca658ee1d628d1f3aa8b4efb47f93fe57dd4ac1b",
      "media_type": "image/png",
      "source": "依使用者提供的人物參考圖進行 identity-preserve 臉部校準，2026-08-08 核准"
    },
    {
      "role": "turnaround",
      "path": "characters/chiying/images/chiying_turnaround_v3.png",
      "sha256": "da38320b2e127f4dc345426ebaa42c4be81de86ec7c2e371255b57556faaff80",
      "media_type": "image/png",
      "source": "依核准臉部身份錨點生成的 imagegen 標準四面總覽，2026-08-08 核准"
    },
    {
      "role": "full_body_front",
      "path": "characters/chiying/images/chiying_v3_front.png",
      "sha256": "a5d20d02d5f83611f8a7d19d0ff88d449569482f89064926d2d9a982142d58ec",
      "media_type": "image/png",
      "source": "由核准 v3 四面總覽無縮放裁切：正面"
    },
    {
      "role": "full_body_three_quarter",
      "path": "characters/chiying/images/chiying_v3_three_quarter.png",
      "sha256": "f93daca8fdb489089e5728e41b4a603a3d6565a2a5bfaf651ccbe1c21a1e87c7",
      "media_type": "image/png",
      "source": "由核准 v3 四面總覽無縮放裁切：四分之三"
    },
    {
      "role": "full_body_profile",
      "path": "characters/chiying/images/chiying_v3_profile.png",
      "sha256": "f538978065c8f28d75f43b1344c3bea72a1a93d402634b0dacfc127b4137476f",
      "media_type": "image/png",
      "source": "由核准 v3 四面總覽無縮放裁切：完整右側面"
    },
    {
      "role": "full_body_back",
      "path": "characters/chiying/images/chiying_v3_back.png",
      "sha256": "f840efb95790900b93247a1992dfc32260421aac79a454ce6a57fa561578ecfb",
      "media_type": "image/png",
      "source": "由核准 v3 四面總覽無縮放裁切：背面"
    }
  ],
  "engine_bindings": {
    "codex": {
      "reference_roles": [
        "face_front",
        "full_body_front",
        "full_body_three_quarter",
        "full_body_profile",
        "full_body_back"
      ],
      "notes": "臉部身份錨點必須優先引用；四個獨立全身視角共同鎖定服裝、比例與影絲結構。"
    },
    "gemini": {
      "reference_roles": [
        "face_front",
        "full_body_front",
        "full_body_three_quarter",
        "full_body_back"
      ],
      "notes": "受參考圖數限制時先保留 face_front，再保留正面、四分之三與背面。"
    }
  }
}
