{
  "schema_version": 1,
  "reference_set_id": "lu_sihai-core-v1",
  "character_id": "lu_sihai",
  "version": 1,
  "label": "標準四面核心造型",
  "status": "approved",
  "is_primary": true,
  "references": [
    {
      "role": "turnaround",
      "path": "characters/lu_sihai/images/lu_sihai_turnaround_v1.png",
      "sha256": "07c724e7eec2c204ee9bc7a865f1dba2e3469bfd85c1036677544e4ddd1d2a0b",
      "media_type": "image/png",
      "source": "imagegen 標準四面總覽，2026-08-11 核准"
    },
    {
      "role": "full_body_front",
      "path": "characters/lu_sihai/images/lu_sihai_v1_front.png",
      "sha256": "5077dfce3ad08cdf7651e2c29e494afeeab4835940d5e6b5099a3e2e1e03ee1d",
      "media_type": "image/png",
      "source": "由核准四面總覽無損裁切：正面"
    },
    {
      "role": "full_body_three_quarter",
      "path": "characters/lu_sihai/images/lu_sihai_v1_three_quarter.png",
      "sha256": "1519d5a0b187516f06fe40d358d9654f563daec52c2df0b329bdebdf0fd9951a",
      "media_type": "image/png",
      "source": "由核准四面總覽無損裁切：四分之三"
    },
    {
      "role": "full_body_profile",
      "path": "characters/lu_sihai/images/lu_sihai_v1_profile.png",
      "sha256": "02b4916549ec56acdfad19813c6b6af2d73f511e130cd609caac851fbd9a9812",
      "media_type": "image/png",
      "source": "由核准四面總覽無損裁切：完整側面"
    },
    {
      "role": "full_body_back",
      "path": "characters/lu_sihai/images/lu_sihai_v1_back.png",
      "sha256": "dd9e52fc042c65da948f8a0c2401f4230f94fe9a9ea1084aebf2fe08cd46358d",
      "media_type": "image/png",
      "source": "由核准四面總覽無損裁切：背面"
    }
  ],
  "engine_bindings": {
    "codex": {
      "reference_roles": [
        "full_body_front",
        "full_body_three_quarter",
        "full_body_profile",
        "full_body_back"
      ],
      "notes": "場景生成前必須引用同一版本的四個獨立視角；turnaround 供人工整體核對。"
    },
    "gemini": {
      "reference_roles": [
        "full_body_front",
        "full_body_three_quarter",
        "full_body_profile",
        "full_body_back"
      ],
      "notes": "優先傳入四個獨立視角；受參考圖數限制時保留正面、四分之三與背面。"
    }
  }
}

