{
  "schema_version": 1,
  "reference_set_id": "gu_hansheng-core-v1",
  "character_id": "gu_hansheng",
  "version": 1,
  "label": "標準四面核心造型",
  "status": "approved",
  "is_primary": true,
  "references": [
    {
      "role": "turnaround",
      "path": "characters/gu_hansheng/images/gu_hansheng_turnaround_v1.png",
      "sha256": "eb7831fcd6e6903deb25cf76a2d261f6da2f98b65cdda37d268cf2fd609b27f1",
      "media_type": "image/png",
      "source": "imagegen 標準四面總覽，2026-08-11 核准"
    },
    {
      "role": "full_body_front",
      "path": "characters/gu_hansheng/images/gu_hansheng_v1_front.png",
      "sha256": "0207c98bc344ea6bbd9de0f4ad9866f9498dd04ec96c7178b280a549440cbf60",
      "media_type": "image/png",
      "source": "由核准四面總覽無損裁切：正面"
    },
    {
      "role": "full_body_three_quarter",
      "path": "characters/gu_hansheng/images/gu_hansheng_v1_three_quarter.png",
      "sha256": "c91eede0d4b5443f5dc049ee47b82aee59c637c30063273fc09ab9946025f9d3",
      "media_type": "image/png",
      "source": "由核准四面總覽無損裁切：四分之三"
    },
    {
      "role": "full_body_profile",
      "path": "characters/gu_hansheng/images/gu_hansheng_v1_profile.png",
      "sha256": "3fcde904b7850a8079bf3c68613219f786ea2f095e61e42f083fa7d99889c984",
      "media_type": "image/png",
      "source": "由核准四面總覽無損裁切：完整側面"
    },
    {
      "role": "full_body_back",
      "path": "characters/gu_hansheng/images/gu_hansheng_v1_back.png",
      "sha256": "4222a25e2d2abdead4b22b4cf076549a685195d5e17db4d8a1992b0d48565dee",
      "media_type": "image/png",
      "source": "由核准四面總覽無損裁切：背面"
    }
  ],
  "engine_bindings": {
    "codex": {
      "reference_roles": [
        "full_body_front",
        "full_body_three_quarter",
        "full_body_profile",
        "full_body_back"
      ],
      "notes": "場景生成前必須引用同一版本的四個獨立視角；turnaround 供人工整體核對。"
    },
    "gemini": {
      "reference_roles": [
        "full_body_front",
        "full_body_three_quarter",
        "full_body_profile",
        "full_body_back"
      ],
      "notes": "優先傳入四個獨立視角；受參考圖數限制時保留正面、四分之三與背面。"
    }
  }
}

